{
  "candidate_locked": true,
  "generation_settings": {
    "format": "schemas/model_output.schema.json",
    "num_ctx": 8192,
    "num_predict": 512,
    "runtime_model": "qwen3:8b",
    "seed": 20260713,
    "temperature": 0,
    "think": true
  },
  "git_commit": "bd73ac9f5147466ec5526203cbee4fe446593de3",
  "implementation_files": {
    "data/baseline/v4_parser_lock.json": "364429b918e2e1938f4f754c2a2768936d121a78dd0a0a4dffb0b08e8eef5b29",
    "schemas/candidate_lock.schema.json": "ff58fcc740374b9671ba289b0fe061a8abfefa870756c892d0cb241bc6321c05",
    "schemas/capture_manifest.schema.json": "e9baf718872fa4bd07731576152948a42cada74c527a5474224d883cb778e6c9",
    "schemas/evaluation_record.schema.json": "5eccebc20ac69ab2822bd62961b7d0db58f2c40d01b19af51b62c415d04aeada",
    "schemas/label_lock.schema.json": "363bf6eaa9566df775e94a08afc2f3ff449e02b8bdae98593e87658091954205",
    "schemas/label_record.schema.json": "eacc00bf302cfbdf04638587db54fa31b41ae93ae69fa24cf7b6bdfe5dddcbf7",
    "schemas/model_output.schema.json": "585feb252686807555c66f0080e0da65dd0e73a5ef20718ee7a1ac124235d1b6",
    "scripts/README.md": "879844acb07918c1f01449cf5c37afc23a0fde7d7e552d761203fb0dd617dda1",
    "scripts/benchmark_v4_development.py": "7c65cb5aa9dafd7f38ee5e47c22a5b9017ad74b876c8a99b7cbb85a23f5d7c82",
    "scripts/create_label_queue.py": "dca270b05b47a531eff196094781496ed7aa216e55ee2708431193c98bfc1002",
    "scripts/import_prospective_snapshot.py": "fe4df2f5c0544a39f3ddab4654083a4a9a51419b51e3c8ee3a0a8d7489cbcab2",
    "scripts/lock_candidate.py": "a54badc2ae9351dcf6bff632c7df140faeb9b482ce059b8600ecf650cec3d7a9",
    "scripts/lock_labels.py": "939444e95bcd8be734b8f0f928f5ab04de75d077a145a85717876bad0cf05dde",
    "scripts/prepare_cases.py": "b3bbe9927b4ebdb6e360336ece1a4dad1c22a32523fdcd23e868d5ec1aee9f58",
    "scripts/review_clusters.py": "eb18c31c05faf3f17d3ed22ff015ce99a7b36a07b3f6528796e0ac5fa13d498a",
    "scripts/review_contamination.py": "8320e63ed15d02275c67a71e4a53764eeafe9191aa9c880c2c2ebd35f1147444",
    "scripts/run_v4_baseline.py": "feae775e923416579505b3afb1b9bde4caf1423f539bec2d86aff8ac38abf818",
    "scripts/score_saved_responses.py": "7a36ac197ae78831771072f056c7d79b6178c996b5afe86aa317b761693283a1",
    "scripts/verify_protocol.ps1": "4fbf7a42626e1b49d59a00f5e9918c6b4693c059183db59ed036e852b57d74ee",
    "src/v5_eval/__init__.py": "00c6d4a2e803903876201aa9469f8aae231278a548ae6eb25b9a826e24ba3482",
    "src/v5_eval/core.py": "5fae5d97ae63ca675f414f4b39b6187725e5bf28ead7e9bd7d7dcae0a8e146f3",
    "src/v5_eval/freeze.py": "d8ec92389d9dc19bddcdac7a922caedf99226f3a5e989ee813e04d84083133c1",
    "src/v5_eval/scoring.py": "f103f349bdec7ca7efa579238010ef7577f65ce1568efe736d26a50ac2ee16c5",
    "src/v5_eval/v4_baseline.py": "f762ebf0b3a57dd1453d63c2c3c46bfb9054f7458af64ee69e481a517463712f",
    "src/v5_eval/workflow.py": "08c14df283631c4e14f2d1b8d9e171ee0f921c8c568708d2cdaf3d40a125cb03"
  },
  "locked_at": "2026-07-12T17:32:58-04:00",
  "model_config_hash": "402ac1ac6580d550bff489dc3431ce8a1aca106a9a1ea7f97f8626ec078c4b9c",
  "model_id": "qwen3:8b@500a1f067a9f",
  "output_schema_file": "schemas/model_output.schema.json",
  "output_schema_hash": "585feb252686807555c66f0080e0da65dd0e73a5ef20718ee7a1ac124235d1b6",
  "prompt_file": "prompts/blind_trade_classifier.txt",
  "prompt_hash": "a10b3abfb420e4baac12026a05c6665734afa55d8ebca4b949d7108450198c02",
  "protocol_id": "v5-prospective-1",
  "quantization": "Q4_K_M; blob sha256:a3de86cd1c132c822487ededd47a324c50491393e6565cd14bafa40d0b8e686f",
  "runtime": "Ollama",
  "runtime_version": "0.31.2",
  "timeout_ms": 8000
}
